NAME,DOI,PRIMARY_LOCATION
A template-based approach for annotating long-tail datasets,None,http://ceur-ws.org/Vol-2722/profiles2020-paper-3.pdf
Best practices for implementing fair vocabularies and ontologies on the web,None,https://doi.org/10.3233/ssw200034
Drugs4Covid: Drug-driven Knowledge Exploitation based on Scientific Publications,https://doi.org/10.48550/arXiv.2012.01953,https://arxiv.org/abs/2012.01953
"Polypharmacy and Drug–Drug Interactions in People Living With Human Immunodeficiency Virus in the Region of Madrid, Spain: A Population-Based Study",None,https://doi.org/10.1093/cid/ciz811
Enhancing Public Procurement in the European Union Through Constructing and Exploiting an Integrated Knowledge Graph,None,https://doi.org/10.1007/978-3-030-62466-8_27
OpenADR Ontology: Semantic Enrichment of Demand Response Strategies in Smart Grids,None,https://doi.org/10.1109/sest48500.2020.9203093
Semantic Interoperability for DR Schemes Employing the SGAM Framework,None,https://doi.org/10.1109/sest48500.2020.9203338
Ontologías para describir datos enlazados,None,http://www.scielo.mec.pt/pdf/rist/nspe3/nspe3a06.pdf
Proceedings of the 10th Workshop on Ontology Design and Patterns (WOP 2019),None,http://www.diva-portal.org/smash/record.jsf?pid=diva2:1358287
Proceedings of the 8th Linked Data in Architecture and Construction Workshop (LDAC2020,None,None
Ontologías y vocabularios para la normalización de datos abiertos,None,https://dialnet.unirioja.es/servlet/articulo?codigo=7480703
On learning context-aware rules to link RDF datasets,None,https://doi.org/10.1093/jigpal/jzaa043
SIMULATION OF DISSEMINATION STRATEGIES ON TEMPORAL NETWORKS,None,https://doi.org/10.23919/annsim52504.2021.9552126
A Distributed Ledger Based Infrastructure for Smart Transportation System and Social Good,None,https://doi.org/10.1109/ccnc46108.2020.9045640
Mapeathor: Simplifying the specification of declarative rules for knowledge graph construction,None,http://ceur-ws.org/Vol-2721/paper488.pdf
Unveiling the diversity of spatial data infrastructures in Latin America: evidence from an exploratory inquiry,10.1080/15230406.2020.1772113,https://doi.org/10.1080/15230406.2020.1772113
A Proposal for Semantic Integration of Crime Data in Mexico City,10.1007/978-3-030-59872-3_3,https://doi.org/10.1007/978-3-030-59872-3_3
Morph-CSV: Virtual knowledge graph access for tabular data,None,http://ceur-ws.org/Vol-2721/paper478.pdf
Standards for the IoT,10.1007/978-3-030-45316-9_6,https://doi.org/10.1109/jiot.2014.2332005
Ontologies for IoT Semantic Interoperability,10.1007/978-3-030-45316-9_5,https://doi.org/10.1109/wf-iot.2018.8355091
Preface,None,https://doi.org/10.1016/s0304-0208(06)80001-0
Evaluating the impact of semantic technologies on bibliographic systems: A user-centred and comparative approach,10.1016/j.websem.2019.03.001,https://doi.org/10.1016/j.websem.2019.03.001
"Ontology based E-learning framework: A personalized, adaptive and context aware model",10.1007/s11042-019-08125-8,https://doi.org/10.1007/s11042-019-08125-8
SoMEF: A Framework for Capturing Scientific Software Metadata from its Documentation,10.1109/BigData47090.2019.9006447,https://doi.org/10.1109/bigdata47090.2019.9006447
Deep neural network architectures for social services diagnosis in smart cities,10.1016/j.future.2019.05.034,https://doi.org/10.1016/j.future.2019.05.034
Survey of agent-based cloud computing applications,10.1016/j.future.2019.04.037,https://doi.org/10.1016/j.future.2019.04.037
"Potentially inappropriate medications in older adults with HIV in the region of Madrid, Spain",None,https://bjo.bmj.com/content/bjophthalmol/86/8/941.full.pdf
Scalable Cross-lingual Document Similarity through Language-specific Concept Hierarchies,None,https://doi.org/10.1145/3360901.3364444
PaCTS 1.0: A Crowdsourced Reporting Standard for Paleoclimate Data,10.1029/2019PA003632,https://agupubs.onlinelibrary.wiley.com/doi/pdfdirect/10.1029/2019PA003632
Semantic Modelling of Plans and Execution Traces for Enhancing Transparency of IoT Systems,10.1109/IOTSMS48152.2019.8939260,https://doi.org/10.1109/iotsms48152.2019.8939260
Scalable Cross-lingual Document Similarity through Language-specific Concept Hierarchies,10.1145/3360901.3364444,https://doi.org/10.1145/3360901.3364444
T2WML table to wikidata mapping language,10.1145/3360901.3364448,https://dl.acm.org/doi/pdf/10.1145/3360901.3364448
"Participation of women in doctorate, research, innovation, and management activities at Universidad Politécnica de Madrid: analysis of the decade 2006–2016",10.1007/s11192-019-03179-9,https://doi.org/10.1007/s11192-019-03179-9
OKG-soft: An open knowledge graph with machine readable scientific software metadata,10.1109/eScience.2019.00046,https://doi.org/10.1109/escience.2019.00046
Ontological Model for the Semantic Description of Syllabuses,10.1145/3357419.3357442,https://doi.org/10.1145/3357419.3357442
Why are ontologies not reused across the same domain?,10.1016/j.websem.2018.12.010,https://doi.org/10.1016/j.websem.2018.12.010
Ontology evolution for personalised and adaptive activity recognition,10.1049/iet-wss.2018.5209,https://doi.org/10.1049/iet-wss.2018.5209
Automating ontology engineering support activities with OnToology,10.1016/j.websem.2018.09.003,https://doi.org/10.1016/j.websem.2018.09.003
Automating ontology engineering support activities with OnToology,None,https://doi.org/10.1016/j.websem.2018.09.003
"Polypharmacy and Drug–Drug Interactions in People Living With Human Immunodeficiency Virus in the Region of Madrid, Spain: A Population-Based Study",None,https://doi.org/10.1093/cid/ciz811
Closing the awareness gap between it practice and it law,10.3233/FAIA190006,https://doi.org/10.3233/FAIA190006
Language resources as linked data for the legal domain,10.3233/FAIA190019,https://doi.org/10.3233/FAIA190019
Closing the Awareness Gap Between IT Practice and IT Law - Critical Legal Positivism Applied in the Domain of IT Law,None,https://doi.org/10.2307/2192998
Language Resources as Linked Data for the Legal Domain,None,https://doi.org/10.3233/FAIA190019
Spanish Corpora for Sentiment Analysis: a Survey,None,https://doi.org/10.1007/s10579-019-09470-8
Taxi dispatching strategies with compensations,10.1016/j.eswa.2019.01.001,https://doi.org/10.1016/j.eswa.2019.01.001
"Retraction notice to “Applying case-based reasoning in social computing to transform colors into music” (Engineering Applications of Artificial Intelligence (2018) 72 (1–9), (S0952197618300563), (10.1016/j.engappai.2018.03.007))",10.1016/j.engappai.2019.03.007,None
VICINITY: IoT Semantic Interoperability Based on the Web of Things,10.1109/DCOSS.2019.00061,https://doi.org/10.1109/dcoss.2019.00061
"Prediction and Decision-Making in Intelligent Environments Supported by Knowledge Graphs, A Systematic Review",10.3390/s19081774,https://www.mdpi.com/1424-8220/19/8/1774/pdf?version=1555141210
Calculating Heavy-Duty truck energy and fuel consumption using correlation formulas derived from vecto simulations,10.4271/2019-01-1278,https://doi.org/10.4271/2019-01-1278
A generalized component efficiency and Input-Data generation model for creating Fleet-Representative vehicle simulation cases in vecto,10.4271/2019-01-1280,https://doi.org/10.4271/2019-01-1280
"An intelligent interface for integrating climate, hydrology, agriculture, and socioeconomic models",10.1145/3308557.3308711,https://dl.acm.org/doi/pdf/10.1145/3308557.3308711
A sustainable process and toolbox for geographical linked data generation and publication: a case study with BTN100,10.1186/s40965-019-0060-4,https://opengeospatialdata.springeropen.com/track/pdf/10.1186/s40965-019-0060-4
Toward proactive social inclusion powered by machine learning,10.1007/s10115-018-1230-x,https://doi.org/10.1007/s10115-018-1230-x
Enhancing energy management at district and building levels via an EM-KPI ontology,10.1016/j.autcon.2018.12.010,https://doi.org/10.1016/j.autcon.2018.12.010
A framework for connecting two interoperability universes: OGC Web Feature Services and Linked Data,10.1111/tgis.12496,https://doi.org/10.1111/tgis.12496
ETSI TS 103 410-3. SmartM2M; Smart Appliances extension to SA,None,None
ETSI TS 103 410-4. SmartM2M; Smart Appliances extension to SA,None,None
ETSI TS 103 410-5. SmartM2M; Smart Appliances extension to SA,None,None
"Best practices for publishing, retrieving, and using spatial data on the web",10.3233/SW-180305,https://doi.org/10.3233/sw-180305
Completeness and consistency analysis for evolving knowledge bases,10.1016/j.websem.2018.11.004,https://doi.org/10.1016/j.websem.2018.11.004
"The modular SSN ontology: A joint W3C and OGC standard specifying the semantics of sensors, observations, sampling, and actuation",10.3233/SW-180320,https://doi.org/10.3233/sw-180320
Ontological Representation of Smart City Data: From Devices to Cities,10.3390/app9010032,https://www.mdpi.com/2076-3417/9/1/32/pdf?version=1545833153
CORAL: A corpus of ontological requirements annotated with lexico-syntactic patterns,10.1007/978-3-030-21348-0_29,https://doi.org/10.1007/978-3-030-21348-0_29
Supervising attention in an e-learning system,10.1007/978-3-030-01746-0_46,https://doi.org/10.1007/978-3-030-01746-0_46
Towards a Knowledge Graph Based Platform for Public Procurement,10.1007/978-3-030-14401-2_29,https://doi.org/10.1007/978-3-030-14401-2_29
Conformance Test Cases for the RDF Mapping Language (RML),10.1007/978-3-030-21395-4_12,https://doi.org/10.1007/978-3-030-21395-4_12
Themis: A tool for validating ontologies through requirements,10.18293/SEKE2019-117,https://doi.org/10.18293/seke2019-117
Morph-GraphQL: GraphQL servers generation from R2RML mappings (SESE),10.18293/SEKE2019-055,None
Introduction to the Special Issue Artificial Intelligence Knowledge Representation,10.3390/systems7030035,https://doi.org/10.1038/nature14539
Towards a Linked Democracy Model,10.1007/978-3-030-13363-4_4,https://doi.org/10.1353/lar.2004.0049
Deliberative and Epistemic Approaches to Democracy,10.1007/978-3-030-13363-4_2,https://link.springer.com/content/pdf/10.1007%2F978-3-030-13363-4_2.pdf
"Linked Democracy Foundations, Tools, and Applications Introduction to Linked Data",10.1007/978-3-030-13363-4_1,https://doi.org/10.5465/annals.2015.0101
Legal Linked Data Ecosystems and the Rule of Law,10.1007/978-3-030-13363-4_5,https://link.springer.com/content/pdf/10.1007%2F978-3-030-13363-4_5.pdf
Multilayered Linked Democracy,10.1007/978-3-030-13363-4_3,https://link.springer.com/content/pdf/10.1007%2F978-3-030-13363-4_3.pdf
"Linked Democracy Foundations, Tools, and Applications Conclusion",10.1007/978-3-030-13363-4_6,https://onlinelibrary.wiley.com/doi/pdfdirect/10.1111/j.1467-6486.2010.00950.x
An Abstract Framework for Non-Cooperative Multi-Agent Planning,10.3390/app9235180,https://www.mdpi.com/2076-3417/9/23/5180/pdf?version=1575008421
Towards an Ontology for Public Procurement Based on the Open Contracting Data Standard,10.1007/978-3-030-29374-1_19,https://doi.org/10.1007/978-3-030-29374-1_19
SAD Generator: Eating Our Own Dog Food to Generate KGs and Websites for Academic Events,10.1007/978-3-030-32327-1_19,https://doi.org/10.1007/978-3-030-32327-1_19
Towards Blockchain and Semantic Web,10.1007/978-3-030-36691-9_19,https://doi.org/10.1007/978-3-030-36691-9_19
Towards human-guided machine learning,10.1145/3301275.3302324,https://dl.acm.org/doi/pdf/10.1145/3301275.3302324
A quality assessment approach for evolving knowledge bases,10.3233/SW-180324,https://doi.org/10.3233/sw-180324
Ontology-driven semantic unified modelling for concurrent activity recognition (OSCAR),10.1007/s11042-018-6318-5,https://doi.org/10.1007/s11042-018-6318-5
Extension of the BIdo ontology to represent scientific production,10.1145/3318396.3318422,https://doi.org/10.1145/3318396.3318422
Automatic music generation by deep learning,10.1007/978-3-319-94649-8_34,https://doi.org/10.1007/978-3-319-94649-8_34
Social services diagnosis by deep learning,10.1007/978-3-319-94649-8_38,https://doi.org/10.1176/ajp.137.5.535
Similar Terms Grouping Yields Faster Terminological Saturation,10.1007/978-3-030-13929-2_3,https://doi.org/10.1007/978-3-030-13929-2_3
Using the SPAR ontology network to represent the scientific production of a university: A case study,10.1007/978-3-030-16187-3_20,https://doi.org/10.1007/978-3-030-16187-3_20
An intelligent and autoadaptive system of virtual identities based on deep learning for the analysis of online advertising networks,10.1007/978-3-030-24299-2_26,https://doi.org/10.1007/978-3-030-24299-2_26
"Linked Democracy Foundations, Tools, and Applications Preface",10.1007/978-3-030-13363-4,https://doi.org/10.1080/13613320500110519
TempCourt: evaluation of temporal taggers on a new corpus of court decisions,10.1017/S0269888919000195,https://doi.org/10.1017/s0269888919000195
ContractFrames: Bridging the Gap Between Natural Language and Logics in Contract Law,10.1007/978-3-030-31605-1_9,https://doi.org/10.1007/978-3-030-31605-1_9
What are the parameters that affect the construction of a knowledge graph?,10.1007/978-3-030-33246-4_43,https://doi.org/10.1007/978-3-030-33246-4_43
How to Validate Ontologies with Themis,10.1007/978-3-030-32327-1_11,https://doi.org/10.1007/978-3-030-32327-1_11
PSM-Flow: Probabilistic Subgraph Mining for Discovering Reusable Fragments in Workflows,10.1109/WI.2018.00-93,https://doi.org/10.1109/wi.2018.00-93
Towards Automated Hypothesis Testing in Neuroscience,10.1007/978-3-030-33752-0_18,https://doi.org/10.1007/978-3-030-33752-0_18
Automatic enrichment of terminological resources: The IATE RDF example,None,https://aran.library.nuigalway.ie/bitstream/10379/14881/1/automatic-enrichment-terminological_final.pdf
Preface,None,https://doi.org/10.1016/s0304-0208(06)80001-0
Optimizing automated term extraction for terminological saturation measurement,None,http://ceur-ws.org/Vol-2387/20190001.pdf
Foreword,None,http://www.kidney-international.org/article/S0085253815538933/pdf
Onett: Systematic knowledge graph generation for national access points,None,http://ceur-ws.org/Vol-2447/paper8.pdf
Preface,None,https://doi.org/10.1016/s0304-0208(06)80001-0
"The semantic sensor network ontology, revamped",None,https://doi.org/10.1109/mc.2003.1160055
Videogames: a lexical approach,None,https://dialnet.unirioja.es/servlet/articulo?codigo=7144227
GraphQL servers generation from R2RML mappings with morph-GraphQL (DEMO),None,None
An overview of the TBFY knowledge graph for public procurement,None,http://ceur-ws.org/Vol-2456/paper14.pdf
Towards the definition of a language-independent mapping template for knowledge graph creation,None,http://ceur-ws.org/Vol-2526/short3.pdf
Preface for the knowledge graph building and large scale RDF analytics workshops,None,https://doi.org/10.1007/978-3-540-78831-7
"ISWC 2019 posters & demonstrations, industry, and outrageous ideas tracks",None,None
Building up communication skills: professional and academic training for engineers,9788417969059,https://dialnet.unirioja.es/servlet/libro?codigo=825965
"Semantic workflows for benchmark challenges: Enhancing comparability, reusability and reproducibility",None,https://doi.org/10.1142/9789813279827_0019
T2WML: A cell-based language to map tables into wikidata records,None,http://ceur-ws.org/Vol-2456/paper12.pdf
Semantic workflows and machine learning for the assessment of carbon storage by urban trees,None,http://ceur-ws.org/Vol-2526/paper1.pdf
WDPlus: Leveraging wikidata to link and extend tabular data,None,http://ceur-ws.org/Vol-2526/short4.pdf
Linking abstract plans of scientific experiments to their corresponding execution traces,None,https://aura.abdn.ac.uk/bitstream/2164/13408/1/Markovic_LinkingAbstractPlans_VOR.pdf
Ontological representation of smart city data: From devices to cities,None,https://www.mdpi.com/2076-3417/9/1/32/pdf?version=1545833153
CORAL: a corpus of ontological requirements annotated with lexico-syntactic patterns,None,https://doi.org/10.1007/978-3-030-21348-0_29
VICINITY: IoT semantic interoperability based on the web of things,None,https://doi.org/10.1109/dcoss.2019.00061
Linked Open Terms (LOT) Methodology,None,https://doi.org/10.1016/j.engappai.2022.104755
Extension of the BiDO ontology to represent scientific production,None,https://doi.org/10.1145/3318396.3318422
Large-Scale Semantic Exploration of Scientific Literature using Topic-based Hashing Algorithms,None,https://doi.org/10.3233/sw-200373
"Potentially inappropriate medications in older adults with HIV in the region of Madrid, Spain",None,https://bjo.bmj.com/content/bjophthalmol/86/8/941.full.pdf
Scalable Cross-lingual Document Similarity through Language-specific Concept Hierarchies,None,https://doi.org/10.1145/3360901.3364444
Legal document retrieval across languages: topic hierarchies based on synsets,None,https://arxiv.org/pdf/1911.12637.pdf
Towards blockchain and semantic web,None,https://doi.org/10.1007/978-3-030-36691-9_19
"Ontologías, Datos Enlazados (Linked Data) y",None,https://e-revistas.uc3m.es/index.php/CIAN/article/download/3147/1787
Ontological Representation of Smart City Data: From Devices to Cities,None,https://www.mdpi.com/2076-3417/9/1/32/pdf?version=1545833153
Semantic technologies and interoperability in the built environment,None,https://content.iospress.com:443/download/semantic-web/sw321?id=semantic-web%2Fsw321
Proceedings of the 7th Linked Data in Architecture and Construction Workshop (LDAC2019),None,https://hal.archives-ouvertes.fr/hal-03165225
Enhancing the maintainability of the Bio2RDF project using declarative mappings,None,http://ceur-ws.org/Vol-2849/paper-01.pdf
Semantic software metadata for workflow exploration and evolution,10.1109/eScience.2018.00132,https://doi.org/10.1109/escience.2018.00132
Models to represent linguistic linked data,10.1017/S1351324918000347,https://doi.org/10.1017/s1351324918000347
Modelling a smart environment for nonintrusive analysis of attention in the workplace,10.1111/exsy.12275,https://doi.org/10.1111/exsy.12275
Polypharmacy and drug-drug interactions in HIV-infected subjects in the region of Madrid (Spain): a population-based study,None,https://doi.org/10.2174/157016209789973691
Polypharmacy and drug-drug interactions in HIV-infected subjects in the region of Madrid (Spain): a population-based study,None,https://doi.org/10.2174/157016209789973691
A Secured and Trusted Demand Response system based on Blockchain technologies,10.1109/INISTA.2018.8466303,https://doi.org/10.1109/inista.2018.8466303
Using machine learning to optimize parallelism in big data applications,10.1016/j.future.2017.07.003,https://doi.org/10.1016/j.future.2017.07.003
"Keeping up with storage: Decentralized, write-enabled dynamic geo-replication",10.1016/j.future.2017.06.009,https://doi.org/10.1016/j.future.2017.06.009
MAS: A Corpus of Tweets for Marketing in Spanish,None,https://doi.org/10.1007/978-3-319-98192-5_53
KerA: Scalable data ingestion for stream processing,10.1109/ICDCS.2018.00152,https://doi.org/10.1109/icdcs.2018.00152
SLoG: Large-scale logging middleware for HPC and big data convergence,10.1109/ICDCS.2018.00156,https://doi.org/10.1109/icdcs.2018.00156
TýrFS: Increasing small files access performance with dynamic metadata replication,10.1109/CCGRID.2018.00072,https://doi.org/10.1109/ccgrid.2018.00072
Applying case-based reasoning in social computing to transform colors into music,10.1016/j.engappai.2018.03.007,https://doi.org/10.1016/j.engappai.2018.03.007
Smart Waste Collection System with Low Consumption LoRaWAN Nodes and Route Optimization,10.3390/s18051465,https://www.mdpi.com/1424-8220/18/5/1465/pdf
Design And Implementation Of A Low-Cost Universal Control For Intelligent Electric Wheelchairs,10.1109/TLA.2018.8408424,https://doi.org/10.1109/tla.2018.8408424
Predicting incorrect mappings: A data-driven approach applied to DBpedia,10.1145/3167132.3167164,https://doi.org/10.1109/tkde.2011.253
RDF shape induction using knowledge base profiling,10.1145/3167132.3167341,https://doi.org/10.1145/3167132.3167341
Relationship recommender system in a business and employment-oriented social network,10.1016/j.ins.2017.12.050,https://doi.org/10.1016/j.ins.2017.12.050
Linked Democracy.Linked Democracy,9783030133634,None
"Drivers, standards and platforms for the IoT: Towards a digital VICINITY",10.1109/IntelliSys.2017.8324287,https://doi.org/10.1109/intellisys.2017.8324287
A Context-Aware Indoor Air Quality System for Sudden Infant Death Syndrome Prevention,10.3390/s18030757,https://www.mdpi.com/1424-8220/18/3/757/pdf?version=1519986905
Agent-based tool to reduce the maintenance cost of energy distribution networks,10.1007/s10115-017-1120-7,https://doi.org/10.1007/s10115-017-1120-7
Students' Evaluation of a Virtual World for Procedural Training in a Tertiary-Education Course,10.1177/0735633117706047,https://doi.org/10.1177/0735633117706047
"Association between CFH, CFB, ARMS2, SERPINF1, VEGFR1 and VEGF polymorphisms and anatomical and functional response to ranibizumab treatment in neovascular age-related macular degeneration",10.1111/aos.13519,https://onlinelibrary.wiley.com/doi/pdfdirect/10.1111/aos.13519
Cross-Evaluation of Automated Term Extraction Tools by Measuring Terminological Saturation,None,https://doi.org/10.1007/978-3-319-76168-8_7
The Influence of the Order of Adding Documents to Datasets on Terminological Saturation,None,https://www.bmj.com/content/bmj/349/bmj.g7647.full.pdf
Increasing the Intensity over Time of an Electric-Assist Bike Based on the User and Route: The Bike Becomes the Gym,10.3390/s18010220,https://www.mdpi.com/1424-8220/18/1/220/pdf?version=1515922049
Neural networks in distributed computing and artificial intelligence,10.1016/j.neucom.2017.06.022,https://doi.org/10.1016/j.neucom.2017.06.022
Multi-Agent System for Demand Prediction and Trip Visualization in Bike Sharing Systems,10.3390/app8010067,https://www.mdpi.com/2076-3417/8/1/67/pdf?version=1515142581
Combination of Multi-Agent Systems and Wireless Sensor Networks for the Monitoring of Cattle,10.3390/s18010108,https://www.mdpi.com/1424-8220/18/1/108/pdf?version=1516694198
Predicting the risk of suffering chronic social exclusion with machine learning,10.1007/978-3-319-62410-5_16,https://doi.org/10.1007/978-3-319-62410-5_16
A guideline for reporting experimental protocols in life sciences,10.7717/peerj.4795,https://peerj.com/articles/4795.pdf
A Comprehensive Quality Model for Linked Data,10.3233/SW-170267,https://doi.org/10.3233/sw-170267
FMonE: A Flexible Monitoring Solution at the Edge,10.1155/2018/2068278,https://doi.org/10.1155/2018/2068278
Semantic technologies and interoperability in the built environment,10.3233/SW-180321,https://content.iospress.com:443/download/semantic-web/sw321?id=semantic-web%2Fsw321
The apertium bilingual dictionaries on the web of data,10.3233/SW-170258,https://doi.org/10.3233/sw-170258
Dealing with Demand in Electric Grids with an Adaptive Consumption Management Platform,10.1155/2018/4012740,http://downloads.hindawi.com/journals/complexity/2018/4012740.pdf
IoT Approaches for Distributed Computing,10.1155/2018/9741053,http://downloads.hindawi.com/journals/wcmc/2018/9741053.pdf
Classification of retinal vessels using a collaborative agent-based architecture,10.3233/AIC-180772,https://doi.org/10.3233/aic-180772
Assess and Enhancing Attention in Learning Activities,10.1007/978-3-319-73210-7_93,https://doi.org/10.1007/978-3-319-73210-7_93
Machine learning-based query augmentation for SPARQL endpoints,10.5220/0006925300570067,https://doi.org/10.5220/0006925300570067
Assigning Creative Commons Licenses to Research Metadata: Issues and Cases,10.1007/978-3-030-00178-0_16,https://doi.org/10.1007/978-3-030-00178-0_16
Fuzzy semantic labeling of semi-structured numerical datasets,10.1007/978-3-030-03667-6_2,https://doi.org/10.1007/978-3-030-03667-6_2
A SAREF extension for semantic interoperability in the industry and manufacturing domain,10.1002/9781119564034.ch25,https://doi.org/10.1002/9781119564034.ch25
PROFILES & DATA: SEARCH – International Workshop on Profiling & Searching Data on the Web Chairs’ Welcome,10.1145/3184558.3192316,None
A Secured and Trusted Demand Response system based on Blockchain technologies,None,https://doi.org/10.1109/inista.2018.8466303
MAS: A Corpus of Tweets for Marketing in Spanish,10.1007/978-3-319-98192-5_53,https://doi.org/10.1007/978-3-319-98192-5_53
Cross-Evaluation of Automated Term Extraction Tools by Measuring Terminological Saturation,10.1007/978-3-319-76168-8_7,https://doi.org/10.1007/978-3-319-76168-8_7
Semantic Discovery in the Web of Things,10.1007/978-3-319-74433-9_2,https://doi.org/10.1007/978-3-319-74433-9_2
Characterize a human-robot interaction: Robot personal assistance,10.1007/978-3-319-62530-0_8,https://doi.org/10.1007/978-3-319-62530-0_8
DBtravel: A tourism-oriented semantic graph,10.1007/978-3-030-03056-8_19,https://doi.org/10.1007/978-3-030-03056-8_19
Type prediction of RDF knowledge graphs using binary classifiers with structural data,10.1007/978-3-030-03056-8_27,https://doi.org/10.1007/978-3-030-03056-8_27
Publishing tourism statistics as linked data a case study of Sri Lanka,10.1007/978-3-030-03056-8_17,https://doi.org/10.1007/978-3-030-03056-8_17
Knowledge base evolution analysis: A case study in the tourism domain,10.1007/978-3-030-03056-8_26,https://doi.org/10.1287/orsc.2.1.125
Linked-Fiestas: A knowledge graph to promote cultural tourism in Spain,10.1007/978-3-030-03056-8_18,https://doi.org/10.1007/978-3-030-03056-8_18
Reuse and Reengineering of Non-ontological Resources in the Legal Domain,10.1007/978-3-030-00178-0_24,https://doi.org/10.1007/978-3-030-00178-0_24
A Linked Data Terminology for Copyright Based on Ontolex-Lemon,10.1007/978-3-030-00178-0_28,https://doi.org/10.1007/978-3-030-00178-0_28
Requirements behaviour analysis for ontology testing,10.1007/978-3-030-03667-6_8,https://doi.org/10.1007/978-3-030-03667-6_8
