NAME,DOI,PRIMARY_LOCATION
Inferring types on large datasets applying ontology class hierarchy classifiers: The dbpedia case,10.1007/978-3-030-03667-6_21,https://doi.org/10.1007/978-3-030-03667-6_21
CREATING AND IMPROVING EDUCATIONAL MATERIALS: AN APPROACH BASED ON CROWDSOURCING,None,https://www.bmj.com/content/bmj/372/bmj.n160.full.pdf
Reliability and correlation analysis of computed methods to convert conventional 2D radiological hindfoot measurements to a 3D setting using weightbearing CT,10.1007/s11548-018-1727-5,https://doi.org/10.1007/s11548-018-1727-5
LawORDate: A service for distinguishing legal references from temporal expressions,None,http://ceur-ws.org/Vol-2049/04paper.pdf
Building the legal knowledge graph for smart compliance services in multilingual Europe,None,http://ceur-ws.org/Vol-2049/02paper.pdf
Architecting data science education,None,https://doi.org/10.1016/j.landurbplan.2010.08.006
Challenge-based learning in computational biology and data science,None,https://doi.org/10.1137/0705041
Refining terminological saturation using string similarity measures,None,http://ceur-ws.org/Vol-2105/10000003.pdf
Spanish corpus of tweets for marketing,None,https://doi.org/10.1007/978-3-319-98192-5_53
Preface,None,https://doi.org/10.1016/s0304-0208(06)80001-0
SlideWiki - Towards a collaborative and accessible platform for slide presentations,None,None
Ontological requirement specification for smart irrigation systems: A SOSA/SSN and SAREF comparison,None,https://hal.science/hal-02042584/document
Proceedings of the 9th international semantic sensor networks workshop (SSN 2018) held at the 17th International Semantic Web Conference (ISWC 2018),None,None
Preface,None,https://doi.org/10.1016/s0304-0208(06)80001-0
Preface,None,https://doi.org/10.1016/s0304-0208(06)80001-0
Extending the SAREF ontology for building devices and topology?,None,https://doi.org/10.1016/j.autcon.2019.01.020
Besoins ontologiques d'un système d'irrigation intelligent: Comparaison entre SSN et SAREF,None,https://hal.science/hal-01841316/document
Towards integrating public procurement data into a semantic knowledge graph,None,http://ceur-ws.org/Vol-2262/ekaw-poster-01.pdf
NLP4Types: predicting types using NLP,None,http://ceur-ws.org/Vol-2262/ekaw-demo-19-poster.pdf
OOPS!: A Pitfall-Based System for Ontology Diagnosis,None,https://doi.org/10.4018/ijswis.2014040102
Predicting Incorrect Mappings: A Data-Driven Approach Applied to DBpedia,None,https://doi.org/10.1109/tkde.2011.253
DBtravel: A Tourism-Oriented Semantic Graph,None,https://doi.org/10.1007/978-3-030-03056-8_19
Machine Learning-based Query Augmentation for SPARQL Endpoints,None,https://doi.org/10.5220/0006925300570067
Inferring Types on Large Datasets Applying Ontology Class Hierarchy Classifiers: The DBpedia Case,None,https://doi.org/10.1007/978-3-030-03667-6_21
Publishing Tourism Statistics as Linked Data a Case Study of Sri Lanka,None,https://doi.org/10.1007/978-3-030-03056-8_17
Preface,None,https://doi.org/10.1016/s0304-0208(06)80001-0
Extending the SAREF ontology for building devices and topology,None,https://doi.org/10.1016/j.autcon.2019.01.020
Semantic technologies and interoperability in the built environment,None,https://content.iospress.com:443/download/semantic-web/sw321?id=semantic-web%2Fsw321
Ontological requirement specification for smart irrigation systems: a SOSA/SSN and SAREF comparison,None,https://hal.science/hal-02042584/document
A SAREF extension for semantic interoperability in the industry and manufacturing domain,None,https://doi.org/10.1002/9781119564034.ch25
Besoins ontologiques d'un système d'irrigation intelligent: comparaison entre SSN et SAREF,None,https://hal.science/hal-01841316/document
Enabling interoperability-as-a-service for connected IoT infrastructures and Smart Objects,None,https://ieeexplore.ieee.org/ielx7/9739/7331734/07123563.pdf
Polypharmacy in HIV-infected and non-HIV-infected individuals in the region of Madrid (Spain): A population-based study,None,https://doi.org/10.2174/157016209789973691
The Influence of the Order of Adding Documents to Datasets on Terminological Saturation,None,https://www.bmj.com/content/bmj/349/bmj.g7647.full.pdf
Proceedings of the 6th Linked Data in Architecture and Construction Workshop (LDAC2018),None,None
Advances in Pattern-Based Ontology Engineering,None,https://doi.org/10.3233/ssw51
"OWL: Experiences and Directions – Reasoner Evaluation (13th International Workshop, OWLED 2016, and 5th International Workshop, ORE 2016, Bologna, Italy, November 20, 2016, Revised Selected Papers)",None,None
Linked Open Vocabularies (LOV): a gateway to reusable semantic vocabularies on the,None,https://doi.org/10.3233/sw-160213
Efficient Clustering from Distributions over Topics,10.1145/3148011.3148019,https://doi.org/10.1145/3148011.3148019
Efficient Clustering from Distributions over Topics,10.1145/3103010,https://doi.org/10.1145/3148011.3148019
Efficient Clustering from Distributions over Topics,10.5281/zenodo,https://doi.org/10.1145/3148011.3148019
Efficient Clustering from Distributions over Topics,10.14778/2180912.2180915,https://doi.org/10.1145/3148011.3148019
Efficient Clustering from Distributions over Topics,10.1145/2133806.2133826,https://doi.org/10.1145/3148011.3148019
Efficient Clustering from Distributions over Topics,10.1109/MSP,https://doi.org/10.1145/3148011.3148019
Efficient Clustering from Distributions over Topics,10.1162/jmlr.2003.3.4,https://doi.org/10.1145/3148011.3148019
Efficient Clustering from Distributions over Topics,10.1017/CBO9781107415324.004,https://doi.org/10.1145/3148011.3148019
Efficient Clustering from Distributions over Topics,10.1023/A:1007537716579,https://doi.org/10.1145/3148011.3148019
Efficient Clustering from Distributions over Topics,10.1002/(SICI)1097-4571(199009),https://doi.org/10.1145/3148011.3148019
Efficient Clustering from Distributions over Topics,10.1023/A:1012801612483,https://doi.org/10.1145/3148011.3148019
Efficient Clustering from Distributions over Topics,10.3115/1613715.1613763,https://doi.org/10.1145/3148011.3148019
Efficient Clustering from Distributions over Topics,10.1145/2806416.2806475,https://doi.org/10.1145/3148011.3148019
Distributing Text Mining tasks with librAIry,10.1145/3103010.3121040,https://doi.org/10.1145/3103010.3121040
Distributing Text Mining tasks with librAIry,10.4018/jswis.2009081901,https://doi.org/10.1145/3103010.3121040
Distributing Text Mining tasks with librAIry,10.1371/journal.pcbi.1002854,https://doi.org/10.1145/3103010.3121040
Distributing Text Mining tasks with librAIry,10.13140/RG.2.1.3257.4961,https://doi.org/10.1145/3103010.3121040
Distributing Text Mining tasks with librAIry,10.1145/514183.514185,https://doi.org/10.1145/3103010.3121040
Distributing Text Mining tasks with librAIry,10.3115/v1,https://doi.org/10.1145/3103010.3121040
Quantifying Reproducibility in Computational Biology: The Case of the Tuberculosis Drugome,10.1371/journal.pone.0080278,https://journals.plos.org/plosone/article/file?id=10.1371/journal.pone.0080278&type=printable
Review of the state of the art: Discovering and Associating Semantics to Tags in Folksonomies,10.1017/S026988891100018X,https://doi.org/10.1017/s026988891100018x
Ontology Development by Reuse,10.1007/978-3-642-24794-1_7,https://doi.org/10.1006/ijhc.1995.1081
Integrating WordNet and Wiktionary with lemon,10.1007/978-3-642-28249-2_3,https://doi.org/10.1007/978-3-642-28249-2_3
Ontology Requirements Specification,10.1007/978-3-642-24794-1_5,https://doi.org/10.1007/978-3-642-05151-7_16
The NeOn Methodology for Ontology Engineering,10.1007/978-3-642-24794-1_2,https://doi.org/10.1007/978-3-642-24794-1_2
Introduction: Ontology Engineering in a Networked World,10.1007/978-3-642-24794-1_1,https://doi.org/10.1007/978-3-642-24794-1_1
Scheduling Ontology Engineering Projects Using gOntt,10.1007/978-3-642-24794-1_14,https://doi.org/10.1007/978-3-642-24794-1_14
A Semantically Enhanced UPnP Control Point for Sharing Multimedia Content,10.1109/MIC.2011.83,https://doi.org/10.1109/mic.2011.83
The landscape of multimedia ontologies in the last decade,10.1007/s11042-011-0905-z,https://doi.org/10.1007/s11042-011-0905-z
Five Challenges for the Semantic Sensor Web,10.3233/SW-2010-0005,https://doi.org/10.3233/sw-2010-0005
Developing Ontologies withing Decentralized Settings,10.1007/978-1-4419-5908-9_4,https://journals.plos.org/plosone/article/file?id=10.1371/journal.pone.0251171&type=printable
"A framework and computer system for knowledge-level acquisition, representation, and reasoning with process knowledge",10.1016/j.ijhcs.2010.05.004,https://doi.org/10.1016/j.ijhcs.2010.05.004
"A Tool Suite to Enable Web Designers, Web Application Developers and End-users to Handle Semantic Data",10.4018/jswis.2010070103,https://doi.org/10.4018/ijswis.2010070103
A Contribution-based Framework for the Creation of Semantically-enabled Web Applications,10.1016/j.ins.2009.07.004,https://doi.org/10.1016/j.ins.2009.07.004
Semantic Web-enabled Protocol Mediation for the Logistics Domain,10.4018/978-1-60566-066-0.ch004,https://doi.org/10.4018/978-1-60566-982-3.ch101
Semantic Content Mediation and Acquisition: The Challenge for Semantic e-Business Solutions,10.4018/978-1-59904-192-6,http://oa.upm.es/5651/2/CL05_OpenArchive.pdf
Architectural Patterns for the Semantic Grid,10.1007/978-0-387-37831-2_8,https://doi.org/10.1007/978-0-387-37831-2_8
A Layered Model for Building Ontology Translation Systems,10.4018/978-1-59904-426-2,https://doi.org/10.4018/jswis.2005040102
Personal eBanking Solutions Based on Semantic Web Services,10.1007/978-3-540-37017-8_13,https://doi.org/10.1007/978-3-540-37017-8_13
Legal Ontologies for the spanish e-Government,10.1007/11881216_32,https://doi.org/10.1007/11881216_32
Ontology Based Document Annotation: Trends and Open Research Problems,10.1504/IJMSO.2006.008769,https://doi.org/10.1504/ijmso.2006.008769
"R2O, an extensible and semantically based database-to-ontology mapping language",10.1007/b106149,http://oa.upm.es/5678/
Reference Ontology and (ONTO)2 Agent: The Ontology Yellow pages,10.1007/PL00011649,https://doi.org/10.1007/pl00011649
Knowledge Maps: An Essential Technique for Conceptualization,10.1016/S0169-023X(99)00050-6,https://doi.org/10.2307/30036519
